,TicketID,Subject,Dealer,Company,Assigned To,Registered By
30,TS000164236,ACTUALIZAR TELEFONOS CON BASE DE DATOS,TSO Mobile - Colombia,TTSO MOBILE S.A.S COL,José Hurtado,Diana Ramirez Fernandez
31,TS000164206,"REVISION UBICACION CAM AUXILIAR, FALTA DE SONIDO Y DESFASE HORARIO EN VIDEOS",TSO Mobile Peru,C Y C TRANSPORT CORPORATION SAC,José Hurtado,Jorge Solis
32,TS000164198,Actualización de scripts para TopFly.,TSO Mobile - Colombia,TTSO MOBILE S.A.S COL,José Hurtado,José Hurtado
33,TS000164108,Carga masiva de LEADS.,TSO Mobile - Colombia,TTSO MOBILE S.A.S COL,José Hurtado,José Hurtado
34,TS000164088,UNIDADES VIDFLEET IA CON NOVEDADES A REPORTAR A WAYLENS,TSO Mobile - Colombia,TTSO MOBILE S.A.S COL,José Hurtado,Alvaro Castañeda
43,TS000163708,ERROR EN REPORTE DE EVENTOS,TSO Mobile - Colombia,ECOBANO SAS,José Hurtado,Cesar Briñez
